{
  "schema_version": "0.1.1",
  "catalog_version": "0.1.1",
  "thinker_id": "TH.PLATO",
  "sources": [
    {
      "source_id": "PLSRC.DL_3_57_62",
      "citation": "Diogenes Laertius, Lives of Eminent Philosophers III.57–62 (trans. R. D. Hicks), Perseus Digital Library.",
      "url": "https://www.perseus.tufts.edu/hopper/text?doc=urn:cts:greekLit:tlg0004.tlg001.perseus-eng1:3.1",
      "source_type": "ANCIENT_TESTIMONY",
      "notes": "Primary ancient testimony for Thrasyllan tetralogies, thirteen Epistles, and an explicit list of spurious dialogues."
    },
    {
      "source_id": "PLSRC.BURNET_V_PERSEUS",
      "citation": "John Burnet (ed.), Platonis Opera, Tomus V: Tetralogia IX, Definitiones, et Spuria; Perseus catalog record.",
      "url": "https://catalog.perseus.tufts.edu/catalog/urn:cts:greekLit:tlg0059.tlg034.perseus-grc1",
      "source_type": "CRITICAL_EDITION",
      "notes": "Catalog metadata records volume contents including Minos, Laws, Epinomis, Epistles, Definitiones, De iusto, De virtute, Demodocus, Sisyphus, Eryxias, Axiochus."
    },
    {
      "source_id": "PLSRC.BURNET_EPISTLES_PERSEUS",
      "citation": "John Burnet (ed.), Platonis Epistulae / Letters; Perseus catalog record.",
      "url": "https://catalog.perseus.tufts.edu/catalog/urn:cts:greekLit:tlg0059.tlg036.opp-grc1",
      "source_type": "CRITICAL_EDITION",
      "notes": "Edition-level attestation for the extant thirteen-letter collection; member-level recipient metadata remains under review."
    },
    {
      "source_id": "PLSRC.JAZDZEWSKA_2022",
      "citation": "Katarzyna Jażdżewska, 'Platonic Dubia and the Appendix Platonica', in Greek Dialogue in Antiquity: Post-Platonic Transformations (Oxford University Press, 2022).",
      "url": "https://doi.org/10.1093/oso/9780192893352.003.0005",
      "source_type": "MODERN_SCHOLARSHIP",
      "notes": "Modern analytical distinction between Thrasyllan dubia and extra-canonical pseudo-Platonic dialogues."
    },
    {
      "source_id": "PLSRC.HALCYON_PERSEUS",
      "citation": "Pseudo-Lucian, Halcyon, ed. Karl Jacobitz; First1KGreek / Perseus.",
      "url": "https://beta.perseus.tufts.edu/urn:cts:greekLit:tlg0061.tlg004.1st1K-grc1/",
      "source_type": "CATALOG",
      "notes": "Extant Halcyon survives in the Pseudo-Lucian textual tradition; Diogenes III.62 attests an ancient Platonic ascription while calling it spurious."
    },
    {
      "source_id": "PLSRC.PERSEUS_EPIGRAMMATA",
      "citation": "Perseus Catalog, Epigrammata under the Plato textgroup (tlg0059.tlg039).",
      "url": "https://catalog.perseus.tufts.edu/catalog/urn:cts:greekLit:tlg0059.tlg039",
      "source_type": "ANTHOLOGY",
      "notes": "Catalog evidence for a corpus of epigrams transmitted/ascribed under Plato's name."
    },
    {
      "source_id": "PLSRC.PAGE_EPIGRAMS",
      "citation": "Denys L. Page, Further Greek Epigrams, Part 2: Epigrams ascribed to famous names of the pre-Alexandrian era (Cambridge University Press, online 2010).",
      "url": "https://doi.org/10.1017/CBO9780511719998.005",
      "source_type": "MODERN_SCHOLARSHIP",
      "notes": "Reports collections of epigrams ascribed to Plato circulating before the end of the second century BCE; authenticity is a separate question."
    },
    {
      "source_id": "PLSRC.BURY_EPISTLES_LOEB",
      "citation": "R. G. Bury (trans. & intro.), Plato: Timaeus, Critias, Cleitophon, Menexenus, Epistles, Loeb Classical Library; digital transcription of the Epistles and prefatory notes.",
      "url": "https://www.viachrista.org/Library/Plato_Epistles_Loeb.html",
      "source_type": "CRITICAL_EDITION",
      "notes": "Used to verify manuscript-order letter headings/addressees and relevant prefatory notes; compared with Diogenes Laertius III.61."
    }
  ],
  "entries": [
    {
      "alternate_titles": [],
      "provisional_work_code": "EUTHYPHRO",
      "parent_catalog_id": null,
      "notes": null,
      "runtime_visibility": "CUSTODIAN_ONLY",
      "catalog_id": "TH.PLATO.CAT.EUTHYPHRO",
      "entry_type": "WORK",
      "canonical_title": "Euthyphro",
      "survival_status": "EXTANT",
      "runtime_candidacy": "TEXT_CANDIDATE",
      "attestations": [
        {
          "source_id": "PLSRC.DL_3_57_62",
          "system": "THRASYLLAN_TETRALOGIES",
          "status": "INCLUDED",
          "position": "1.1",
          "note": null
        }
      ],
      "review_status": "SOURCE_VERIFIED"
    },
    {
      "alternate_titles": [],
      "provisional_work_code": "APOLOGY",
      "parent_catalog_id": null,
      "notes": null,
      "runtime_visibility": "CUSTODIAN_ONLY",
      "catalog_id": "TH.PLATO.CAT.APOLOGY",
      "entry_type": "WORK",
      "canonical_title": "Apology of Socrates",
      "survival_status": "EXTANT",
      "runtime_candidacy": "TEXT_CANDIDATE",
      "attestations": [
        {
          "source_id": "PLSRC.DL_3_57_62",
          "system": "THRASYLLAN_TETRALOGIES",
          "status": "INCLUDED",
          "position": "1.2",
          "note": null
        }
      ],
      "review_status": "SOURCE_VERIFIED"
    },
    {
      "alternate_titles": [],
      "provisional_work_code": "CRITO",
      "parent_catalog_id": null,
      "notes": null,
      "runtime_visibility": "CUSTODIAN_ONLY",
      "catalog_id": "TH.PLATO.CAT.CRITO",
      "entry_type": "WORK",
      "canonical_title": "Crito",
      "survival_status": "EXTANT",
      "runtime_candidacy": "TEXT_CANDIDATE",
      "attestations": [
        {
          "source_id": "PLSRC.DL_3_57_62",
          "system": "THRASYLLAN_TETRALOGIES",
          "status": "INCLUDED",
          "position": "1.3",
          "note": null
        }
      ],
      "review_status": "SOURCE_VERIFIED"
    },
    {
      "alternate_titles": [],
      "provisional_work_code": "PHAEDO",
      "parent_catalog_id": null,
      "notes": null,
      "runtime_visibility": "CUSTODIAN_ONLY",
      "catalog_id": "TH.PLATO.CAT.PHAEDO",
      "entry_type": "WORK",
      "canonical_title": "Phaedo",
      "survival_status": "EXTANT",
      "runtime_candidacy": "TEXT_CANDIDATE",
      "attestations": [
        {
          "source_id": "PLSRC.DL_3_57_62",
          "system": "THRASYLLAN_TETRALOGIES",
          "status": "INCLUDED",
          "position": "1.4",
          "note": null
        }
      ],
      "review_status": "SOURCE_VERIFIED"
    },
    {
      "alternate_titles": [],
      "provisional_work_code": "CRATYLUS",
      "parent_catalog_id": null,
      "notes": null,
      "runtime_visibility": "CUSTODIAN_ONLY",
      "catalog_id": "TH.PLATO.CAT.CRATYLUS",
      "entry_type": "WORK",
      "canonical_title": "Cratylus",
      "survival_status": "EXTANT",
      "runtime_candidacy": "TEXT_CANDIDATE",
      "attestations": [
        {
          "source_id": "PLSRC.DL_3_57_62",
          "system": "THRASYLLAN_TETRALOGIES",
          "status": "INCLUDED",
          "position": "2.1",
          "note": null
        }
      ],
      "review_status": "SOURCE_VERIFIED"
    },
    {
      "alternate_titles": [],
      "provisional_work_code": "THEAETETUS",
      "parent_catalog_id": null,
      "notes": null,
      "runtime_visibility": "CUSTODIAN_ONLY",
      "catalog_id": "TH.PLATO.CAT.THEAETETUS",
      "entry_type": "WORK",
      "canonical_title": "Theaetetus",
      "survival_status": "EXTANT",
      "runtime_candidacy": "TEXT_CANDIDATE",
      "attestations": [
        {
          "source_id": "PLSRC.DL_3_57_62",
          "system": "THRASYLLAN_TETRALOGIES",
          "status": "INCLUDED",
          "position": "2.2",
          "note": null
        }
      ],
      "review_status": "SOURCE_VERIFIED"
    },
    {
      "alternate_titles": [],
      "provisional_work_code": "SOPHIST",
      "parent_catalog_id": null,
      "notes": null,
      "runtime_visibility": "CUSTODIAN_ONLY",
      "catalog_id": "TH.PLATO.CAT.SOPHIST",
      "entry_type": "WORK",
      "canonical_title": "Sophist",
      "survival_status": "EXTANT",
      "runtime_candidacy": "TEXT_CANDIDATE",
      "attestations": [
        {
          "source_id": "PLSRC.DL_3_57_62",
          "system": "THRASYLLAN_TETRALOGIES",
          "status": "INCLUDED",
          "position": "2.3",
          "note": null
        }
      ],
      "review_status": "SOURCE_VERIFIED"
    },
    {
      "alternate_titles": [],
      "provisional_work_code": "STATESMAN",
      "parent_catalog_id": null,
      "notes": null,
      "runtime_visibility": "CUSTODIAN_ONLY",
      "catalog_id": "TH.PLATO.CAT.STATESMAN",
      "entry_type": "WORK",
      "canonical_title": "Statesman",
      "survival_status": "EXTANT",
      "runtime_candidacy": "TEXT_CANDIDATE",
      "attestations": [
        {
          "source_id": "PLSRC.DL_3_57_62",
          "system": "THRASYLLAN_TETRALOGIES",
          "status": "INCLUDED",
          "position": "2.4",
          "note": null
        }
      ],
      "review_status": "SOURCE_VERIFIED"
    },
    {
      "alternate_titles": [],
      "provisional_work_code": "PARMENIDES",
      "parent_catalog_id": null,
      "notes": null,
      "runtime_visibility": "CUSTODIAN_ONLY",
      "catalog_id": "TH.PLATO.CAT.PARMENIDES",
      "entry_type": "WORK",
      "canonical_title": "Parmenides",
      "survival_status": "EXTANT",
      "runtime_candidacy": "TEXT_CANDIDATE",
      "attestations": [
        {
          "source_id": "PLSRC.DL_3_57_62",
          "system": "THRASYLLAN_TETRALOGIES",
          "status": "INCLUDED",
          "position": "3.1",
          "note": null
        }
      ],
      "review_status": "SOURCE_VERIFIED"
    },
    {
      "alternate_titles": [],
      "provisional_work_code": "PHILEBUS",
      "parent_catalog_id": null,
      "notes": null,
      "runtime_visibility": "CUSTODIAN_ONLY",
      "catalog_id": "TH.PLATO.CAT.PHILEBUS",
      "entry_type": "WORK",
      "canonical_title": "Philebus",
      "survival_status": "EXTANT",
      "runtime_candidacy": "TEXT_CANDIDATE",